<?xml version="1.0" encoding="UTF-8"?>
<flow id="bookingHotel"
	xmlns="http://www.zkoss.org/2009/zwf"
    xmlns:xsi="http://www.w3.org/2001/XMLSchema-instance"
	xsi:schemaLocation="http://www.zkoss.org/2009/zwf http://www.zkoss.org/2009/zwf/zwf.xsd">
	
	<view-state id="enterBookingDetails">
		<transition id="proceed" to="reviewBooking" />
		<transition id="cancel" to="bookingCancelled" />
	</view-state>
	
	<view-state id="reviewBooking">
		<transition id="confirm" to="agreeBooking" />
		<transition id="revise" to="enterBookingDetails" />
		<transition id="cancel" to="bookingCancelled" />
	</view-state>
	
	<action-state id="agreeBooking" test="agreement.isChecked()">
		<transition id="yes" to="bookingConfirmed" />
		<transition id="no" to="reviewBooking" />
	</action-state>
	
	<end-state id="bookingConfirmed" />
	<end-state id="bookingCancelled" />
	
</flow>